{
  "specVersion": 1,
  "tool": {
    "name": "nput",
    "version": "0.9.0"
  },
  "command": "plan",
  "status": "success",
  "dryRun": true,
  "startedAt": "2026-07-07T21:10:00+09:00",
  "finishedAt": "2026-07-07T21:10:01+09:00",
  "results": [
    {
      "subject": {
        "name": "home"
      },
      "status": "success",
      "generation": {
        "profile": "/nix/var/nix/profiles/per-user/alice/home",
        "before": 41,
        "after": 41
      },
      "startedAt": "2026-07-07T21:10:00+09:00",
      "finishedAt": "2026-07-07T21:10:01+09:00",
      "result": {
        "items": [
          {
            "id": "2ba0b24fb64819dfe4bab60dd153fe5a636bdd5a7535d32039c1fe24736f97f8",
            "kind": "entry",
            "label": ".zshrc",
            "status": "success"
          }
        ],
        "changes": [
          {
            "kind": "modify",
            "itemId": "2ba0b24fb64819dfe4bab60dd153fe5a636bdd5a7535d32039c1fe24736f97f8",
            "reversible": true,
            "info": {
              "oldSrc": "/nix/store/aaa-zshrc",
              "newSrc": "/nix/store/bbb-zshrc"
            }
          }
        ]
      }
    }
  ]
}
