{
  "specVersion": 1,
  "tool": {
    "name": "nput",
    "version": "0.9.0"
  },
  "command": "apply",
  "status": "success",
  "dryRun": false,
  "startedAt": "2026-07-07T22:00:00+09:00",
  "finishedAt": "2026-07-07T22:00:03+09:00",
  "info": {
    "configSource": "git+https://example.com/dotfiles.git",
    "cacheHits": 12
  },
  "results": [
    {
      "subject": {
        "name": "home"
      },
      "status": "success",
      "startedAt": "2026-07-07T22:00:00+09:00",
      "finishedAt": "2026-07-07T22:00:03+09:00",
      "result": {
        "items": [
          {
            "id": "2ba0b24fb64819dfe4bab60dd153fe5a636bdd5a7535d32039c1fe24736f97f8",
            "kind": "entry",
            "label": ".zshrc",
            "status": "success",
            "info": {
              "target": ".zshrc",
              "method": "symlink"
            }
          }
        ],
        "info": {
          "generation": 42
        }
      }
    }
  ]
}
