{
  "specVersion": 1,
  "tool": {
    "name": "nput",
    "version": "0.9.0"
  },
  "command": "apply",
  "status": "success",
  "dryRun": false,
  "startedAt": "2026-07-07T21:00:00+09:00",
  "finishedAt": "2026-07-07T21:00:02+09:00",
  "results": [
    {
      "subject": {
        "name": "home"
      },
      "status": "success",
      "generation": {
        "profile": "/nix/var/nix/profiles/per-user/alice/home",
        "before": 41,
        "after": 42
      },
      "startedAt": "2026-07-07T21:00:00+09:00",
      "finishedAt": "2026-07-07T21:00:01+09:00",
      "result": {
        "items": [
          {
            "id": "2ba0b24fb64819dfe4bab60dd153fe5a636bdd5a7535d32039c1fe24736f97f8",
            "kind": "entry",
            "label": ".zshrc",
            "status": "success"
          }
        ],
        "changes": [
          {
            "kind": "modify",
            "itemId": "2ba0b24fb64819dfe4bab60dd153fe5a636bdd5a7535d32039c1fe24736f97f8",
            "reversible": true
          }
        ]
      }
    },
    {
      "subject": {
        "name": "work"
      },
      "status": "success",
      "generation": {
        "profile": "/nix/var/nix/profiles/per-user/alice/work",
        "after": 1
      },
      "startedAt": "2026-07-07T21:00:01+09:00",
      "finishedAt": "2026-07-07T21:00:02+09:00",
      "result": {
        "items": [
          {
            "id": "4f63987615f37911e2dbb1741f2d88ae288acf3ada4d5b625b54cd94f39429e3",
            "kind": "entry",
            "label": "init.lua",
            "status": "success"
          }
        ],
        "changes": [
          {
            "kind": "add",
            "itemId": "4f63987615f37911e2dbb1741f2d88ae288acf3ada4d5b625b54cd94f39429e3",
            "reversible": true
          }
        ]
      }
    }
  ]
}
