{
  "specVersion": 1,
  "tool": {
    "name": "nput",
    "version": "0.9.0"
  },
  "command": "plan",
  "status": "success",
  "dryRun": true,
  "startedAt": "2026-07-05T12:34:56+09:00",
  "finishedAt": "2026-07-05T12:34:58+09:00",
  "results": [
    {
      "subject": {
        "name": "home"
      },
      "status": "success",
      "startedAt": "2026-07-05T12:34:56+09:00",
      "finishedAt": "2026-07-05T12:34:58+09:00",
      "result": {
        "items": [
          {
            "id": "2ba0b24fb64819dfe4bab60dd153fe5a636bdd5a7535d32039c1fe24736f97f8",
            "kind": "entry",
            "label": ".zshrc",
            "status": "success",
            "info": {
              "target": ".zshrc",
              "method": "symlink"
            }
          },
          {
            "id": "4f63987615f37911e2dbb1741f2d88ae288acf3ada4d5b625b54cd94f39429e3",
            "kind": "entry",
            "label": "init.lua",
            "status": "success",
            "info": {
              "target": ".config/nvim/init.lua",
              "method": "symlink"
            }
          }
        ],
        "changes": [
          {
            "kind": "modify",
            "itemId": "2ba0b24fb64819dfe4bab60dd153fe5a636bdd5a7535d32039c1fe24736f97f8",
            "reversible": true,
            "info": {
              "oldSrc": "/nix/store/aaa-zshrc",
              "newSrc": "/nix/store/bbb-zshrc"
            }
          }
        ],
        "info": {
          "generation": 42
        }
      }
    }
  ]
}
